Uc1-Ability to create a Address Book Service DB

mysql> show databases;
+--------------------+
| Database           |
+--------------------+
| information_schema |
| mysql              |
| payroll_service    |
| performance_schema |
| sakila             |
| sys                |
| world              |
+--------------------+
7 rows in set (0.00 sec)

mysql> create database addressbook_service;
Query OK, 1 row affected (0.10 sec)

mysql> show databases;
+---------------------+
| Database            |
+---------------------+
| addressbook_service |
| information_schema  |
| mysql               |
| payroll_service     |
| performance_schema  |
| sakila              |
| sys                 |
| world               |
+---------------------+
8 rows in set (0.08 sec)

mysql>

Uc2-Ability to create a AddressBook Table with first and last names, address, city,state,zip, phone numberand email as its attributes

mysql> use addressbook_service;
Database changed
mysql> select database();
+---------------------+
| database()          |
+---------------------+
| addressbook_service |
+---------------------+
1 row in set (0.00 sec)

mysql> create table addressbook
    -> (
    -> firstname varchar(150) NOT NULL,
    -> lastname varchar(150) NOT NULL,
    -> address varchar(150) NOT NULL,
    -> city varchar(150) NOT NULL,
    -> state varchar(150) NOT NULL,
    -> zip varchar(150) NOT NULL,
    -> mobilenumber varchar(150) NOT NULL,
    -> email varchar(150) NOT NULL
    -> );
Query OK, 0 rows affected (1.67 sec)

mysql> describe addressbook;
+--------------+--------------+------+-----+---------+-------+
| Field        | Type         | Null | Key | Default | Extra |
+--------------+--------------+------+-----+---------+-------+
| firstname    | varchar(150) | NO   |     | NULL    |       |
| lastname     | varchar(150) | NO   |     | NULL    |       |
| address      | varchar(150) | NO   |     | NULL    |       |
| city         | varchar(150) | NO   |     | NULL    |       |
| state        | varchar(150) | NO   |     | NULL    |       |
| zip          | varchar(150) | NO   |     | NULL    |       |
| mobilenumber | varchar(150) | NO   |     | NULL    |       |
| email        | varchar(150) | NO   |     | NULL    |       |
+--------------+--------------+------+-----+---------+-------+
8 rows in set (0.00 sec)

mysql>

Uc3- Ability to insert new Contacts to AddressBook

mysql> insert into addressbook ( firstname, lastname, address, city, state, zip, mobilenumber,email) values
    -> ( 'sravanthi', 'kallavai', '2/115', 'kurnool', 'andhrapradesh','515626', '9908229348', 'kalavai4@gmail.com'),
    -> ( 'bhavya', 'maligi', '3/343', 'kadapa', 'ts', ' 515765', '8975686645', 'bhavi@gmail.com'),
    -> ( 'hema', 'chitti', '4/987', 'anantapur', 'kerala', '515262', '7869875643', 'hema@gmail.com');
Query OK, 3 rows affected (0.14 sec)
Records: 3  Duplicates: 0  Warnings: 0

mysql> select * from addressbook;
+-----------+----------+---------+-----------+---------------+---------+--------------+--------------------+
| firstname | lastname | address | city      | state         | zip     | mobilenumber | email              |
+-----------+----------+---------+-----------+---------------+---------+--------------+--------------------+
| sravanthi | kallavai | 2/115   | kurnool   | andhrapradesh | 515626  | 9908229348   | kalavai4@gmail.com |
| bhavya    | maligi   | 3/343   | kadapa    | ts            |  515765 | 8975686645   | bhavi@gmail.com    |
| hema      | chitti   | 4/987   | anantapur | kerala        | 515262  | 7869875643   | hema@gmail.com     |
+-----------+----------+---------+-----------+---------------+---------+--------------+--------------------+
3 rows in set (0.04 sec)

mysql>

Uc4- Edit Contact Details of Person using name

mysql> select * from addressbook;
+-----------+----------+---------+-----------+---------------+---------+--------------+--------------------+
| firstname | lastname | address | city      | state         | zip     | mobilenumber | email              |
+-----------+----------+---------+-----------+---------------+---------+--------------+--------------------+
| sravanthi | kallavai | 2/115   | kurnool   | andhrapradesh | 515626  | 9908229348   | kalavai4@gmail.com |
| bhavya    | maligi   | 3/343   | kadapa    | ts            |  515765 | 8975686645   | bhavi@gmail.com    |
| hema      | chitti   | 4/987   | anantapur | kerala        | 515262  | 7869875643   | hema@gmail.com     |
+-----------+----------+---------+-----------+---------------+---------+--------------+--------------------+
3 rows in set (0.04 sec)

mysql> update addressbook set city = 'chittoor' where firstname = 'sravanthi';
Query OK, 1 row affected (0.13 sec)
Rows matched: 1  Changed: 1  Warnings: 0

mysql> select * from addressbook;
+-----------+----------+---------+-----------+---------------+---------+--------------+--------------------+
| firstname | lastname | address | city      | state         | zip     | mobilenumber | email              |
+-----------+----------+---------+-----------+---------------+---------+--------------+--------------------+
| sravanthi | kallavai | 2/115   | chittoor  | andhrapradesh | 515626  | 9908229348   | kalavai4@gmail.com |
| bhavya    | maligi   | 3/343   | kadapa    | ts            |  515765 | 8975686645   | bhavi@gmail.com    |
| hema      | chitti   | 4/987   | anantapur | kerala        | 515262  | 7869875643   | hema@gmail.com     |
+-----------+----------+---------+-----------+---------------+---------+--------------+--------------------+
3 rows in set (0.04 sec)

mysql> update addressbook set lastname = 'kaluvayi' where firstname = 'sravanthi';
Query OK, 1 row affected (0.10 sec)
Rows matched: 1  Changed: 1  Warnings: 0

mysql> select * from addressbook;
+-----------+----------+---------+-----------+---------------+---------+--------------+--------------------+
| firstname | lastname | address | city      | state         | zip     | mobilenumber | email              |
+-----------+----------+---------+-----------+---------------+---------+--------------+--------------------+
| sravanthi | kaluvayi | 2/115   | chittoor  | andhrapradesh | 515626  | 9908229348   | kalavai4@gmail.com |
| bhavya    | maligi   | 3/343   | kadapa    | ts            |  515765 | 8975686645   | bhavi@gmail.com    |
| hema      | chitti   | 4/987   | anantapur | kerala        | 515262  | 7869875643   | hema@gmail.com     |
+-----------+----------+---------+-----------+---------------+---------+--------------+--------------------+
3 rows in set (0.00 sec)

mysql>

Uc5-Delete a Person using persons name

mysql> select * from addressbook;
+-----------+----------+---------+-----------+---------------+---------+--------------+--------------------+
| firstname | lastname | address | city      | state         | zip     | mobilenumber | email              |
+-----------+----------+---------+-----------+---------------+---------+--------------+--------------------+
| sravanthi | kaluvayi | 2/115   | chittoor  | andhrapradesh | 515626  | 9908229348   | kalavai4@gmail.com |
| bhavya    | maligi   | 3/343   | kadapa    | ts            |  515765 | 8975686645   | bhavi@gmail.com    |
| hema      | chitti   | 4/987   | anantapur | kerala        | 515262  | 7869875643   | hema@gmail.com     |
+-----------+----------+---------+-----------+---------------+---------+--------------+--------------------+
3 rows in set (0.00 sec)

mysql> delete from addressbook where firstname = 'hema';
Query OK, 1 row affected (0.13 sec)

mysql> select * from addressbook;
+-----------+----------+---------+----------+---------------+---------+--------------+--------------------+
| firstname | lastname | address | city     | state         | zip     | mobilenumber | email              |
+-----------+----------+---------+----------+---------------+---------+--------------+--------------------+
| sravanthi | kaluvayi | 2/115   | chittoor | andhrapradesh | 515626  | 9908229348   | kalavai4@gmail.com |
| bhavya    | maligi   | 3/343   | kadapa   | ts            |  515765 | 8975686645   | bhavi@gmail.com    |
+-----------+----------+---------+----------+---------------+---------+--------------+--------------------+
2 rows in set (0.09 sec)

Uc6-Ability to Retrieve Person belonging to a City or State from the Address Book

mysql> select * from addressbook;
+-----------+----------+---------+----------+---------------+---------+--------------+--------------------+
| firstname | lastname | address | city     | state         | zip     | mobilenumber | email              |
+-----------+----------+---------+----------+---------------+---------+--------------+--------------------+
| sravanthi | kaluvayi | 2/115   | chittoor | andhrapradesh | 515626  | 9908229348   | kalavai4@gmail.com |
| bhavya    | maligi   | 3/343   | kadapa   | ts            |  515765 | 8975686645   | bhavi@gmail.com    |
+-----------+----------+---------+----------+---------------+---------+--------------+--------------------+
2 rows in set (0.09 sec)

mysql> select from addressbook where city = 'kadapa' or state = 'ts';
ERROR 1064 (42000): You have an error in your SQL syntax; check the manual that corresponds to your MySQL server version for the right syntax to use near 'from addressbook where city = 'kadapa' or state = 'ts'' at line 1
mysql> select * from addressbook where city = 'kadapa' or state = 'ts';
+-----------+----------+---------+--------+-------+---------+--------------+-----------------+
| firstname | lastname | address | city   | state | zip     | mobilenumber | email           |
+-----------+----------+---------+--------+-------+---------+--------------+-----------------+
| bhavya    | maligi   | 3/343   | kadapa | ts    |  515765 | 8975686645   | bhavi@gmail.com |
+-----------+----------+---------+--------+-------+---------+--------------+-----------------+
1 row in set (0.00 sec)

mysql>

Uc7-Ability to understand the size of addressbook by City and State

mysql> select * from addressbook;
+-----------+----------+---------+----------+---------------+---------+--------------+--------------------+
| firstname | lastname | address | city     | state         | zip     | mobilenumber | email              |
+-----------+----------+---------+----------+---------------+---------+--------------+--------------------+
| sravanthi | kaluvayi | 2/115   | chittoor | andhrapradesh | 515626  | 9908229348   | kalavai4@gmail.com |
| bhavya    | maligi   | 3/343   | kadapa   | ts            |  515765 | 8975686645   | bhavi@gmail.com    |
| teja      | busu     | 11/23   | kadapa   | ap            | 123456  | 7689847382   | teja@gmail.com     |
| buddu     | abc      | 32/42   | hyd      | ap            | 435765  | 8764532343   | buddu@gmail.com    |
+-----------+----------+---------+----------+---------------+---------+--------------+--------------------+
4 rows in set (0.04 sec)

mysql> select state,count(state) from addressbook group by state;
+---------------+--------------+
| state         | count(state) |
+---------------+--------------+
| andhrapradesh |            1 |
| ts            |            1 |
| ap            |            2 |
+---------------+--------------+
3 rows in set (0.00 sec)

mysql> select city,count(city) from addressbook group by city;
+----------+-------------+
| city     | count(city) |
+----------+-------------+
| chittoor |           1 |
| kadapa   |           2 |
| hyd      |           1 |
+----------+-------------+
3 rows in set (0.00 sec)

Uc8-Ability to retrieve entries sorted alphabetically by Person’s name for a given city

mysql> select * from addressbook order by firstname;
+-----------+----------+---------+----------+---------------+---------+--------------+--------------------+
| firstname | lastname | address | city     | state         | zip     | mobilenumber | email              |
+-----------+----------+---------+----------+---------------+---------+--------------+--------------------+
| bhavya    | maligi   | 3/343   | kadapa   | ts            |  515765 | 8975686645   | bhavi@gmail.com    |
| buddu     | abc      | 32/42   | hyd      | ap            | 435765  | 8764532343   | buddu@gmail.com    |
| sravanthi | kaluvayi | 2/115   | chittoor | andhrapradesh | 515626  | 9908229348   | kalavai4@gmail.com |
| teja      | busu     | 11/23   | kadapa   | ap            | 123456  | 7689847382   | teja@gmail.com     |
+-----------+----------+---------+----------+---------------+---------+--------------+--------------------+
4 rows in set (0.04 sec)

mysql> select * from addressbook where city = 'kadapa' order by firstname;
+-----------+----------+---------+--------+-------+---------+--------------+-----------------+
| firstname | lastname | address | city   | state | zip     | mobilenumber | email           |
+-----------+----------+---------+--------+-------+---------+--------------+-----------------+
| bhavya    | maligi   | 3/343   | kadapa | ts    |  515765 | 8975686645   | bhavi@gmail.com |
| teja      | busu     | 11/23   | kadapa | ap    | 123456  | 7689847382   | teja@gmail.com  |
+-----------+----------+---------+--------+-------+---------+--------------+-----------------+
2 rows in set (0.00 sec)

Uc9-Ability to identify each Address Book with name and Type.

mysql> select * from addressbook;
+-----------+----------+---------+----------+---------------+---------+--------------+--------------------+
| firstname | lastname | address | city     | state         | zip     | mobilenumber | email              |
+-----------+----------+---------+----------+---------------+---------+--------------+--------------------+
| sravanthi | kaluvayi | 2/115   | chittoor | andhrapradesh | 515626  | 9908229348   | kalavai4@gmail.com |
| bhavya    | maligi   | 3/343   | kadapa   | ts            |  515765 | 8975686645   | bhavi@gmail.com    |
| teja      | busu     | 11/23   | kadapa   | ap            | 123456  | 7689847382   | teja@gmail.com     |
| buddu     | abc      | 32/42   | hyd      | ap            | 435765  | 8764532343   | buddu@gmail.com    |
+-----------+----------+---------+----------+---------------+---------+--------------+--------------------+
4 rows in set (0.00 sec)

mysql> alter table addressbook add type varchar(150) not null after lastname;
Query OK, 0 rows affected (1.38 sec)
Records: 0  Duplicates: 0  Warnings: 0

mysql> select * from addressbook;
+-----------+----------+------+---------+----------+---------------+---------+--------------+--------------------+
| firstname | lastname | type | address | city     | state         | zip     | mobilenumber | email              |
+-----------+----------+------+---------+----------+---------------+---------+--------------+--------------------+
| sravanthi | kaluvayi |      | 2/115   | chittoor | andhrapradesh | 515626  | 9908229348   | kalavai4@gmail.com |
| bhavya    | maligi   |      | 3/343   | kadapa   | ts            |  515765 | 8975686645   | bhavi@gmail.com    |
| teja      | busu     |      | 11/23   | kadapa   | ap            | 123456  | 7689847382   | teja@gmail.com     |
| buddu     | abc      |      | 32/42   | hyd      | ap            | 435765  | 8764532343   | buddu@gmail.com    |
+-----------+----------+------+---------+----------+---------------+---------+--------------+--------------------+
4 rows in set (0.04 sec)

mysql> update addressbook set type = 'family' where firstname = 'sravanthi' or firstname = 'buddu';
Query OK, 2 rows affected (0.13 sec)
Rows matched: 2  Changed: 2  Warnings: 0

mysql> select * from addressbook;
+-----------+----------+--------+---------+----------+---------------+---------+--------------+--------------------+
| firstname | lastname | type   | address | city     | state         | zip     | mobilenumber | email              |
+-----------+----------+--------+---------+----------+---------------+---------+--------------+--------------------+
| sravanthi | kaluvayi | family | 2/115   | chittoor | andhrapradesh | 515626  | 9908229348   | kalavai4@gmail.com |
| bhavya    | maligi   |        | 3/343   | kadapa   | ts            |  515765 | 8975686645   | bhavi@gmail.com    |
| teja      | busu     |        | 11/23   | kadapa   | ap            | 123456  | 7689847382   | teja@gmail.com     |
| buddu     | abc      | family | 32/42   | hyd      | ap            | 435765  | 8764532343   | buddu@gmail.com    |
+-----------+----------+--------+---------+----------+---------------+---------+--------------+--------------------+
4 rows in set (0.00 sec)

mysql> update addressbook set type = 'friends' where firstname = 'bhavya';
Query OK, 1 row affected (0.14 sec)
Rows matched: 1  Changed: 1  Warnings: 0

mysql> select * from addressbook;
+-----------+----------+---------+---------+----------+---------------+---------+--------------+--------------------+
| firstname | lastname | type    | address | city     | state         | zip     | mobilenumber | email              |
+-----------+----------+---------+---------+----------+---------------+---------+--------------+--------------------+
| sravanthi | kaluvayi | family  | 2/115   | chittoor | andhrapradesh | 515626  | 9908229348   | kalavai4@gmail.com |
| bhavya    | maligi   | friends | 3/343   | kadapa   | ts            |  515765 | 8975686645   | bhavi@gmail.com    |
| teja      | busu     |         | 11/23   | kadapa   | ap            | 123456  | 7689847382   | teja@gmail.com     |
| buddu     | abc      | family  | 32/42   | hyd      | ap            | 435765  | 8764532343   | buddu@gmail.com    |
+-----------+----------+---------+---------+----------+---------------+---------+--------------+--------------------+
4 rows in set (0.00 sec)

mysql> update addressbook set type = 'profession' where firstname = 'teja';
Query OK, 1 row affected (0.09 sec)
Rows matched: 1  Changed: 1  Warnings: 0

mysql> select * from addressbook;
+-----------+----------+------------+---------+----------+---------------+---------+--------------+--------------------+
| firstname | lastname | type       | address | city     | state         | zip     | mobilenumber | email              |
+-----------+----------+------------+---------+----------+---------------+---------+--------------+--------------------+
| sravanthi | kaluvayi | family     | 2/115   | chittoor | andhrapradesh | 515626  | 9908229348   | kalavai4@gmail.com |
| bhavya    | maligi   | friends    | 3/343   | kadapa   | ts            |  515765 | 8975686645   | bhavi@gmail.com    |
| teja      | busu     | profession | 11/23   | kadapa   | ap            | 123456  | 7689847382   | teja@gmail.com     |
| buddu     | abc      | family     | 32/42   | hyd      | ap            | 435765  | 8764532343   | buddu@gmail.com    |
+-----------+----------+------------+---------+----------+---------------+---------+--------------+--------------------+
4 rows in set (0.05 sec)


mysql> alter table addressbook add addressBookname varchar(150) not null after firstname;
Query OK, 0 rows affected (1.99 sec)
Records: 0  Duplicates: 0  Warnings: 0

mysql> select * from addressbook;
+-----------+-----------------+----------+------------+---------+----------+---------------+---------+--------------+--------------------+
| firstname | addressBookname | lastname | type       | address | city     | state         | zip     | mobilenumber | email              |
+-----------+-----------------+----------+------------+---------+----------+---------------+---------+--------------+--------------------+
| sravanthi |                 | kaluvayi | family     | 2/115   | chittoor | andhrapradesh | 515626  | 9908229348   | kalavai4@gmail.com |
| bhavya    |                 | maligi   | friends    | 3/343   | kadapa   | ts            |  515765 | 8975686645   | bhavi@gmail.com    |
| teja      |                 | busu     | profession | 11/23   | kadapa   | ap            | 123456  | 7689847382   | teja@gmail.com     |
| buddu     |                 | abc      | family     | 32/42   | hyd      | ap            | 435765  | 8764532343   | buddu@gmail.com    |
+-----------+-----------------+----------+------------+---------+----------+---------------+---------+--------------+--------------------+
4 rows in set (0.00 sec)

mysql> update addressbook set addressBookname = 'ad1' where firstname = 'teja' or firstname = 'bhavya';
Query OK, 2 rows affected (0.05 sec)
Rows matched: 2  Changed: 2  Warnings: 0

mysql> select * from addressbook;
+-----------+-----------------+----------+------------+---------+----------+---------------+---------+--------------+--------------------+
| firstname | addressBookname | lastname | type       | address | city     | state         | zip     | mobilenumber | email              |
+-----------+-----------------+----------+------------+---------+----------+---------------+---------+--------------+--------------------+
| sravanthi |                 | kaluvayi | family     | 2/115   | chittoor | andhrapradesh | 515626  | 9908229348   | kalavai4@gmail.com |
| bhavya    | ad1             | maligi   | friends    | 3/343   | kadapa   | ts            |  515765 | 8975686645   | bhavi@gmail.com    |
| teja      | ad1             | busu     | profession | 11/23   | kadapa   | ap            | 123456  | 7689847382   | teja@gmail.com     |
| buddu     |                 | abc      | family     | 32/42   | hyd      | ap            | 435765  | 8764532343   | buddu@gmail.com    |
+-----------+-----------------+----------+------------+---------+----------+---------------+---------+--------------+--------------------+
4 rows in set (0.06 sec)

mysql> update addressbook set addressBookname = 'ad2' where firstname = 'buddu' or firstname = 'sravanthi';
Query OK, 2 rows affected (0.13 sec)
Rows matched: 2  Changed: 2  Warnings: 0

mysql> select * from addressbook;
+-----------+-----------------+----------+------------+---------+----------+---------------+---------+--------------+--------------------+
| firstname | addressBookname | lastname | type       | address | city     | state         | zip     | mobilenumber | email              |
+-----------+-----------------+----------+------------+---------+----------+---------------+---------+--------------+--------------------+
| sravanthi | ad2             | kaluvayi | family     | 2/115   | chittoor | andhrapradesh | 515626  | 9908229348   | kalavai4@gmail.com |
| bhavya    | ad1             | maligi   | friends    | 3/343   | kadapa   | ts            |  515765 | 8975686645   | bhavi@gmail.com    |
| teja      | ad1             | busu     | profession | 11/23   | kadapa   | ap            | 123456  | 7689847382   | teja@gmail.com     |
| buddu     | ad2             | abc      | family     | 32/42   | hyd      | ap            | 435765  | 8764532343   | buddu@gmail.com    |
+-----------+-----------------+----------+------------+---------+----------+---------------+---------+--------------+--------------------+
4 rows in set (0.00 sec)

Uc10-Ability to get number of contact persons i.e. count by type

mysql> select * from addressbook;
+-----------+-----------------+----------+------------+---------+----------+---------------+---------+--------------+--------------------+
| firstname | addressBookname | lastname | type       | address | city     | state         | zip     | mobilenumber | email              |
+-----------+-----------------+----------+------------+---------+----------+---------------+---------+--------------+--------------------+
| sravanthi | ad2             | kaluvayi | family     | 2/115   | chittoor | andhrapradesh | 515626  | 9908229348   | kalavai4@gmail.com |
| bhavya    | ad1             | maligi   | friends    | 3/343   | kadapa   | ts            |  515765 | 8975686645   | bhavi@gmail.com    |
| teja      | ad1             | busu     | profession | 11/23   | kadapa   | ap            | 123456  | 7689847382   | teja@gmail.com     |
| buddu     | ad2             | abc      | family     | 32/42   | hyd      | ap            | 435765  | 8764532343   | buddu@gmail.com    |
+-----------+-----------------+----------+------------+---------+----------+---------------+---------+--------------+--------------------+
4 rows in set (0.00 sec)

mysql> select type,count(type) from addressbook group by type;
+------------+-------------+
| type       | count(type) |
+------------+-------------+
| family     |           2 |
| friends    |           1 |
| profession |           1 |
+------------+-------------+
3 rows in set (0.00 sec)

Uc11-Ability to add person to both Friend and Family

mysql> insert into addressbook (firstname, addressBookname, lastname, type, address, city, state, zip, mobilenumber, email) values
    -> ('chitti','ad1','def','friends','12-34','kurnool','ts','435678','8765432109','abc@gia.com');
Query OK, 1 row affected (0.10 sec)

mysql> select * from addressbook;
+-----------+-----------------+----------+------------+---------+----------+---------------+---------+--------------+--------------------+
| firstname | addressBookname | lastname | type       | address | city     | state         | zip     | mobilenumber | email              |
+-----------+-----------------+----------+------------+---------+----------+---------------+---------+--------------+--------------------+
| sravanthi | ad2             | kaluvayi | family     | 2/115   | chittoor | andhrapradesh | 515626  | 9908229348   | kalavai4@gmail.com |
| bhavya    | ad1             | maligi   | friends    | 3/343   | kadapa   | ts            |  515765 | 8975686645   | bhavi@gmail.com    |
| teja      | ad1             | busu     | profession | 11/23   | kadapa   | ap            | 123456  | 7689847382   | teja@gmail.com     |
| buddu     | ad2             | abc      | family     | 32/42   | hyd      | ap            | 435765  | 8764532343   | buddu@gmail.com    |
| chitti    | ad1             | def      | friends    | 12-34   | kurnool  | ts            | 435678  | 8765432109   | abc@gia.com        |
+-----------+-----------------+----------+------------+---------+----------+---------------+---------+--------------+--------------------+
5 rows in set (0.04 sec)

mysql> insert into addressbook (firstname, addressBookname, lastname, type, address, city, state, zip, mobilenumber, email) values
    -> ('chitti','ad1','def','family','12-34','kurnool','ts','435678','8765432109','abc@gia.com');
Query OK, 1 row affected (0.13 sec)

mysql> select * from addressbook;
+-----------+-----------------+----------+------------+---------+----------+---------------+---------+--------------+--------------------+
| firstname | addressBookname | lastname | type       | address | city     | state         | zip     | mobilenumber | email              |
+-----------+-----------------+----------+------------+---------+----------+---------------+---------+--------------+--------------------+
| sravanthi | ad2             | kaluvayi | family     | 2/115   | chittoor | andhrapradesh | 515626  | 9908229348   | kalavai4@gmail.com |
| bhavya    | ad1             | maligi   | friends    | 3/343   | kadapa   | ts            |  515765 | 8975686645   | bhavi@gmail.com    |
| teja      | ad1             | busu     | profession | 11/23   | kadapa   | ap            | 123456  | 7689847382   | teja@gmail.com     |
| buddu     | ad2             | abc      | family     | 32/42   | hyd      | ap            | 435765  | 8764532343   | buddu@gmail.com    |
| chitti    | ad1             | def      | friends    | 12-34   | kurnool  | ts            | 435678  | 8765432109   | abc@gia.com        |
| chitti    | ad1             | def      | family     | 12-34   | kurnool  | ts            | 435678  | 8765432109   | abc@gia.com        |
+-----------+-----------------+----------+------------+---------+----------+---------------+---------+--------------+--------------------+
6 rows in set (0.00 sec)